Frame 1: 76 bytes on wire (608 bits), 76 bytes captured (608 bits) on interface 0
    Interface id: 0
    Encapsulation type: Linux cooked-mode capture (25)
    Arrival Time: Oct 17, 2014 21:01:49.319507000 JST
    [Time shift for this packet: 0.000000000 seconds]
    Epoch Time: 1413547309.319507000 seconds
    [Time delta from previous captured frame: 0.000000000 seconds]
    [Time delta from previous displayed frame: 0.000000000 seconds]
    [Time since reference or first frame: 0.000000000 seconds]
    Frame Number: 1
    Frame Length: 76 bytes (608 bits)
    Capture Length: 76 bytes (608 bits)
    [Frame is marked: False]
    [Frame is ignored: False]
    [Protocols in frame: sll:ip:tcp]
Linux cooked capture
    Packet type: Unicast to us (0)
    Link-layer address type: 772
    Link-layer address length: 6
    Source: 00:00:00_00:00:00 (00:00:00:00:00:00)
    Protocol: IP (0x0800)
Internet Protocol Version 4, Src: 127.0.0.1 (127.0.0.1), Dst: 127.0.0.1 (127.0.0.1)
    Version: 4
    Header length: 20 bytes
    Differentiated Services Field: 0x00 (DSCP 0x00: Default; ECN: 0x00: Not-ECT (Not ECN-Capable Transport))
        0000 00.. = Differentiated Services Codepoint: Default (0x00)
        .... ..00 = Explicit Congestion Notification: Not-ECT (Not ECN-Capable Transport) (0x00)
    Total Length: 60
    Identification: 0xbab3 (47795)
    Flags: 0x02 (Don't Fragment)
        0... .... = Reserved bit: Not set
        .1.. .... = Don't fragment: Set
        ..0. .... = More fragments: Not set
    Fragment offset: 0
    Time to live: 64
    Protocol: TCP (6)
    Header checksum: 0x8206 [validation disabled]
        [Good: False]
        [Bad: False]
    Source: 127.0.0.1 (127.0.0.1)
    Destination: 127.0.0.1 (127.0.0.1)
    [Source GeoIP: Unknown]
    [Destination GeoIP: Unknown]
Transmission Control Protocol, Src Port: 35658 (35658), Dst Port: 5329 (5329), Seq: 0, Len: 0
    Source port: 35658 (35658)
    Destination port: 5329 (5329)
    [Stream index: 0]
    Sequence number: 0    (relative sequence number)
    Header length: 40 bytes
    Flags: 0x002 (SYN)
        000. .... .... = Reserved: Not set
        ...0 .... .... = Nonce: Not set
        .... 0... .... = Congestion Window Reduced (CWR): Not set
        .... .0.. .... = ECN-Echo: Not set
        .... ..0. .... = Urgent: Not set
        .... ...0 .... = Acknowledgment: Not set
        .... .... 0... = Push: Not set
        .... .... .0.. = Reset: Not set
        .... .... ..1. = Syn: Set
            [Expert Info (Chat/Sequence): Connection establish request (SYN): server port 5329]
                [Message: Connection establish request (SYN): server port 5329]
                [Severity level: Chat]
                [Group: Sequence]
        .... .... ...0 = Fin: Not set
    Window size value: 43690
    [Calculated window size: 43690]
    Checksum: 0xfe30 [validation disabled]
        [Good Checksum: False]
        [Bad Checksum: False]
    Options: (20 bytes), Maximum segment size, SACK permitted, Timestamps, No-Operation (NOP), Window scale
        Maximum segment size: 65495 bytes
            Kind: MSS size (2)
            Length: 4
            MSS Value: 65495
        TCP SACK Permitted Option: True
            Kind: SACK Permission (4)
            Length: 2
        Timestamps: TSval 1613295, TSecr 0
            Kind: Timestamp (8)
            Length: 10
            Timestamp value: 1613295
            Timestamp echo reply: 0
        No-Operation (NOP)
            Type: 1
                0... .... = Copy on fragmentation: No
                .00. .... = Class: Control (0)
                ...0 0001 = Number: No-Operation (NOP) (1)
        Window scale: 7 (multiply by 128)
            Kind: Window Scale (3)
            Length: 3
            Shift count: 7
            [Multiplier: 128]

Frame 2: 76 bytes on wire (608 bits), 76 bytes captured (608 bits) on interface 0
    Interface id: 0
    Encapsulation type: Linux cooked-mode capture (25)
    Arrival Time: Oct 17, 2014 21:01:49.319543000 JST
    [Time shift for this packet: 0.000000000 seconds]
    Epoch Time: 1413547309.319543000 seconds
    [Time delta from previous captured frame: 0.000036000 seconds]
    [Time delta from previous displayed frame: 0.000036000 seconds]
    [Time since reference or first frame: 0.000036000 seconds]
    Frame Number: 2
    Frame Length: 76 bytes (608 bits)
    Capture Length: 76 bytes (608 bits)
    [Frame is marked: False]
    [Frame is ignored: False]
    [Protocols in frame: sll:ip:tcp]
Linux cooked capture
    Packet type: Unicast to us (0)
    Link-layer address type: 772
    Link-layer address length: 6
    Source: 00:00:00_00:00:00 (00:00:00:00:00:00)
    Protocol: IP (0x0800)
Internet Protocol Version 4, Src: 127.0.0.1 (127.0.0.1), Dst: 127.0.0.1 (127.0.0.1)
    Version: 4
    Header length: 20 bytes
    Differentiated Services Field: 0x00 (DSCP 0x00: Default; ECN: 0x00: Not-ECT (Not ECN-Capable Transport))
        0000 00.. = Differentiated Services Codepoint: Default (0x00)
        .... ..00 = Explicit Congestion Notification: Not-ECT (Not ECN-Capable Transport) (0x00)
    Total Length: 60
    Identification: 0x0000 (0)
    Flags: 0x02 (Don't Fragment)
        0... .... = Reserved bit: Not set
        .1.. .... = Don't fragment: Set
        ..0. .... = More fragments: Not set
    Fragment offset: 0
    Time to live: 64
    Protocol: TCP (6)
    Header checksum: 0x3cba [validation disabled]
        [Good: False]
        [Bad: False]
    Source: 127.0.0.1 (127.0.0.1)
    Destination: 127.0.0.1 (127.0.0.1)
    [Source GeoIP: Unknown]
    [Destination GeoIP: Unknown]
Transmission Control Protocol, Src Port: 5329 (5329), Dst Port: 35658 (35658), Seq: 0, Ack: 1, Len: 0
    Source port: 5329 (5329)
    Destination port: 35658 (35658)
    [Stream index: 0]
    Sequence number: 0    (relative sequence number)
    Acknowledgment number: 1    (relative ack number)
    Header length: 40 bytes
    Flags: 0x012 (SYN, ACK)
        000. .... .... = Reserved: Not set
        ...0 .... .... = Nonce: Not set
        .... 0... .... = Congestion Window Reduced (CWR): Not set
        .... .0.. .... = ECN-Echo: Not set
        .... ..0. .... = Urgent: Not set
        .... ...1 .... = Acknowledgment: Set
        .... .... 0... = Push: Not set
        .... .... .0.. = Reset: Not set
        .... .... ..1. = Syn: Set
            [Expert Info (Chat/Sequence): Connection establish acknowledge (SYN+ACK): server port 5329]
                [Message: Connection establish acknowledge (SYN+ACK): server port 5329]
                [Severity level: Chat]
                [Group: Sequence]
        .... .... ...0 = Fin: Not set
    Window size value: 43690
    [Calculated window size: 43690]
    Checksum: 0xfe30 [validation disabled]
        [Good Checksum: False]
        [Bad Checksum: False]
    Options: (20 bytes), Maximum segment size, SACK permitted, Timestamps, No-Operation (NOP), Window scale
        Maximum segment size: 65495 bytes
            Kind: MSS size (2)
            Length: 4
            MSS Value: 65495
        TCP SACK Permitted Option: True
            Kind: SACK Permission (4)
            Length: 2
        Timestamps: TSval 1613295, TSecr 1613295
            Kind: Timestamp (8)
            Length: 10
            Timestamp value: 1613295
            Timestamp echo reply: 1613295
        No-Operation (NOP)
            Type: 1
                0... .... = Copy on fragmentation: No
                .00. .... = Class: Control (0)
                ...0 0001 = Number: No-Operation (NOP) (1)
        Window scale: 7 (multiply by 128)
            Kind: Window Scale (3)
            Length: 3
            Shift count: 7
            [Multiplier: 128]
    [SEQ/ACK analysis]
        [This is an ACK to the segment in frame: 1]
        [The RTT to ACK the segment was: 0.000036000 seconds]

Frame 3: 68 bytes on wire (544 bits), 68 bytes captured (544 bits) on interface 0
    Interface id: 0
    Encapsulation type: Linux cooked-mode capture (25)
    Arrival Time: Oct 17, 2014 21:01:49.319593000 JST
    [Time shift for this packet: 0.000000000 seconds]
    Epoch Time: 1413547309.319593000 seconds
    [Time delta from previous captured frame: 0.000050000 seconds]
    [Time delta from previous displayed frame: 0.000050000 seconds]
    [Time since reference or first frame: 0.000086000 seconds]
    Frame Number: 3
    Frame Length: 68 bytes (544 bits)
    Capture Length: 68 bytes (544 bits)
    [Frame is marked: False]
    [Frame is ignored: False]
    [Protocols in frame: sll:ip:tcp]
Linux cooked capture
    Packet type: Unicast to us (0)
    Link-layer address type: 772
    Link-layer address length: 6
    Source: 00:00:00_00:00:00 (00:00:00:00:00:00)
    Protocol: IP (0x0800)
Internet Protocol Version 4, Src: 127.0.0.1 (127.0.0.1), Dst: 127.0.0.1 (127.0.0.1)
    Version: 4
    Header length: 20 bytes
    Differentiated Services Field: 0x00 (DSCP 0x00: Default; ECN: 0x00: Not-ECT (Not ECN-Capable Transport))
        0000 00.. = Differentiated Services Codepoint: Default (0x00)
        .... ..00 = Explicit Congestion Notification: Not-ECT (Not ECN-Capable Transport) (0x00)
    Total Length: 52
    Identification: 0xbab4 (47796)
    Flags: 0x02 (Don't Fragment)
        0... .... = Reserved bit: Not set
        .1.. .... = Don't fragment: Set
        ..0. .... = More fragments: Not set
    Fragment offset: 0
    Time to live: 64
    Protocol: TCP (6)
    Header checksum: 0x820d [validation disabled]
        [Good: False]
        [Bad: False]
    Source: 127.0.0.1 (127.0.0.1)
    Destination: 127.0.0.1 (127.0.0.1)
    [Source GeoIP: Unknown]
    [Destination GeoIP: Unknown]
Transmission Control Protocol, Src Port: 35658 (35658), Dst Port: 5329 (5329), Seq: 1, Ack: 1, Len: 0
    Source port: 35658 (35658)
    Destination port: 5329 (5329)
    [Stream index: 0]
    Sequence number: 1    (relative sequence number)
    Acknowledgment number: 1    (relative ack number)
    Header length: 32 bytes
    Flags: 0x010 (ACK)
        000. .... .... = Reserved: Not set
        ...0 .... .... = Nonce: Not set
        .... 0... .... = Congestion Window Reduced (CWR): Not set
        .... .0.. .... = ECN-Echo: Not set
        .... ..0. .... = Urgent: Not set
        .... ...1 .... = Acknowledgment: Set
        .... .... 0... = Push: Not set
        .... .... .0.. = Reset: Not set
        .... .... ..0. = Syn: Not set
        .... .... ...0 = Fin: Not set
    Window size value: 342
    [Calculated window size: 43776]
    [Window size scaling factor: 128]
    Checksum: 0xfe28 [validation disabled]
        [Good Checksum: False]
        [Bad Checksum: False]
    Options: (12 bytes), No-Operation (NOP), No-Operation (NOP), Timestamps
        No-Operation (NOP)
            Type: 1
                0... .... = Copy on fragmentation: No
                .00. .... = Class: Control (0)
                ...0 0001 = Number: No-Operation (NOP) (1)
        No-Operation (NOP)
            Type: 1
                0... .... = Copy on fragmentation: No
                .00. .... = Class: Control (0)
                ...0 0001 = Number: No-Operation (NOP) (1)
        Timestamps: TSval 1613295, TSecr 1613295
            Kind: Timestamp (8)
            Length: 10
            Timestamp value: 1613295
            Timestamp echo reply: 1613295
    [SEQ/ACK analysis]
        [This is an ACK to the segment in frame: 2]
        [The RTT to ACK the segment was: 0.000050000 seconds]

Frame 4: 223 bytes on wire (1784 bits), 223 bytes captured (1784 bits) on interface 0
    Interface id: 0
    Encapsulation type: Linux cooked-mode capture (25)
    Arrival Time: Oct 17, 2014 21:01:49.319683000 JST
    [Time shift for this packet: 0.000000000 seconds]
    Epoch Time: 1413547309.319683000 seconds
    [Time delta from previous captured frame: 0.000090000 seconds]
    [Time delta from previous displayed frame: 0.000090000 seconds]
    [Time since reference or first frame: 0.000176000 seconds]
    Frame Number: 4
    Frame Length: 223 bytes (1784 bits)
    Capture Length: 223 bytes (1784 bits)
    [Frame is marked: False]
    [Frame is ignored: False]
    [Protocols in frame: sll:ip:tcp:ssl]
Linux cooked capture
    Packet type: Unicast to us (0)
    Link-layer address type: 772
    Link-layer address length: 6
    Source: 00:00:00_00:00:00 (00:00:00:00:00:00)
    Protocol: IP (0x0800)
Internet Protocol Version 4, Src: 127.0.0.1 (127.0.0.1), Dst: 127.0.0.1 (127.0.0.1)
    Version: 4
    Header length: 20 bytes
    Differentiated Services Field: 0x00 (DSCP 0x00: Default; ECN: 0x00: Not-ECT (Not ECN-Capable Transport))
        0000 00.. = Differentiated Services Codepoint: Default (0x00)
        .... ..00 = Explicit Congestion Notification: Not-ECT (Not ECN-Capable Transport) (0x00)
    Total Length: 207
    Identification: 0xbab5 (47797)
    Flags: 0x02 (Don't Fragment)
        0... .... = Reserved bit: Not set
        .1.. .... = Don't fragment: Set
        ..0. .... = More fragments: Not set
    Fragment offset: 0
    Time to live: 64
    Protocol: TCP (6)
    Header checksum: 0x8171 [validation disabled]
        [Good: False]
        [Bad: False]
    Source: 127.0.0.1 (127.0.0.1)
    Destination: 127.0.0.1 (127.0.0.1)
    [Source GeoIP: Unknown]
    [Destination GeoIP: Unknown]
Transmission Control Protocol, Src Port: 35658 (35658), Dst Port: 5329 (5329), Seq: 1, Ack: 1, Len: 155
    Source port: 35658 (35658)
    Destination port: 5329 (5329)
    [Stream index: 0]
    Sequence number: 1    (relative sequence number)
    [Next sequence number: 156    (relative sequence number)]
    Acknowledgment number: 1    (relative ack number)
    Header length: 32 bytes
    Flags: 0x018 (PSH, ACK)
        000. .... .... = Reserved: Not set
        ...0 .... .... = Nonce: Not set
        .... 0... .... = Congestion Window Reduced (CWR): Not set
        .... .0.. .... = ECN-Echo: Not set
        .... ..0. .... = Urgent: Not set
        .... ...1 .... = Acknowledgment: Set
        .... .... 1... = Push: Set
        .... .... .0.. = Reset: Not set
        .... .... ..0. = Syn: Not set
        .... .... ...0 = Fin: Not set
    Window size value: 342
    [Calculated window size: 43776]
    [Window size scaling factor: 128]
    Checksum: 0xfec3 [validation disabled]
        [Good Checksum: False]
        [Bad Checksum: False]
    Options: (12 bytes), No-Operation (NOP), No-Operation (NOP), Timestamps
        No-Operation (NOP)
            Type: 1
                0... .... = Copy on fragmentation: No
                .00. .... = Class: Control (0)
                ...0 0001 = Number: No-Operation (NOP) (1)
        No-Operation (NOP)
            Type: 1
                0... .... = Copy on fragmentation: No
                .00. .... = Class: Control (0)
                ...0 0001 = Number: No-Operation (NOP) (1)
        Timestamps: TSval 1613295, TSecr 1613295
            Kind: Timestamp (8)
            Length: 10
            Timestamp value: 1613295
            Timestamp echo reply: 1613295
    [SEQ/ACK analysis]
        [Bytes in flight: 155]
Secure Sockets Layer
    SSL Record Layer: Handshake Protocol: Client Hello
        Content Type: Handshake (22)
        Version: TLS 1.0 (0x0301)
        Length: 150
        Handshake Protocol: Client Hello
            Handshake Type: Client Hello (1)
            Length: 146
            Version: TLS 1.0 (0x0301)
            Random
                gmt_unix_time: Oct 17, 2014 21:01:49.000000000 JST
                random_bytes: 09cb93ead232020279f48c8d418a55702bce7d52f3f01f88...
            Session ID Length: 0
            Cipher Suites Length: 76
            Cipher Suites (38 suites)
                Cipher Suite: TLS_ECDHE_RSA_WITH_AES_256_CBC_SHA (0xc014)
                Cipher Suite: TLS_ECDHE_ECDSA_WITH_AES_256_CBC_SHA (0xc00a)
                Cipher Suite: TLS_DHE_RSA_WITH_AES_256_CBC_SHA (0x0039)
                Cipher Suite: TLS_DHE_DSS_WITH_AES_256_CBC_SHA (0x0038)
                Cipher Suite: TLS_DHE_RSA_WITH_CAMELLIA_256_CBC_SHA (0x0088)
                Cipher Suite: TLS_DHE_DSS_WITH_CAMELLIA_256_CBC_SHA (0x0087)
                Cipher Suite: TLS_ECDH_RSA_WITH_AES_256_CBC_SHA (0xc00f)
                Cipher Suite: TLS_ECDH_ECDSA_WITH_AES_256_CBC_SHA (0xc005)
                Cipher Suite: TLS_RSA_WITH_AES_256_CBC_SHA (0x0035)
                Cipher Suite: TLS_RSA_WITH_CAMELLIA_256_CBC_SHA (0x0084)
                Cipher Suite: TLS_ECDHE_RSA_WITH_3DES_EDE_CBC_SHA (0xc012)
                Cipher Suite: TLS_ECDHE_ECDSA_WITH_3DES_EDE_CBC_SHA (0xc008)
                Cipher Suite: TLS_DHE_RSA_WITH_3DES_EDE_CBC_SHA (0x0016)
                Cipher Suite: TLS_DHE_DSS_WITH_3DES_EDE_CBC_SHA (0x0013)
                Cipher Suite: TLS_ECDH_RSA_WITH_3DES_EDE_CBC_SHA (0xc00d)
                Cipher Suite: TLS_ECDH_ECDSA_WITH_3DES_EDE_CBC_SHA (0xc003)
                Cipher Suite: TLS_RSA_WITH_3DES_EDE_CBC_SHA (0x000a)
                Cipher Suite: TLS_ECDHE_RSA_WITH_AES_128_CBC_SHA (0xc013)
                Cipher Suite: TLS_ECDHE_ECDSA_WITH_AES_128_CBC_SHA (0xc009)
                Cipher Suite: TLS_DHE_RSA_WITH_AES_128_CBC_SHA (0x0033)
                Cipher Suite: TLS_DHE_DSS_WITH_AES_128_CBC_SHA (0x0032)
                Cipher Suite: TLS_DHE_RSA_WITH_SEED_CBC_SHA (0x009a)
                Cipher Suite: TLS_DHE_DSS_WITH_SEED_CBC_SHA (0x0099)
                Cipher Suite: TLS_DHE_RSA_WITH_CAMELLIA_128_CBC_SHA (0x0045)
                Cipher Suite: TLS_DHE_DSS_WITH_CAMELLIA_128_CBC_SHA (0x0044)
                Cipher Suite: TLS_ECDH_RSA_WITH_AES_128_CBC_SHA (0xc00e)
                Cipher Suite: TLS_ECDH_ECDSA_WITH_AES_128_CBC_SHA (0xc004)
                Cipher Suite: TLS_RSA_WITH_AES_128_CBC_SHA (0x002f)
                Cipher Suite: TLS_RSA_WITH_SEED_CBC_SHA (0x0096)
                Cipher Suite: TLS_RSA_WITH_CAMELLIA_128_CBC_SHA (0x0041)
                Cipher Suite: TLS_RSA_WITH_IDEA_CBC_SHA (0x0007)
                Cipher Suite: TLS_ECDHE_RSA_WITH_RC4_128_SHA (0xc011)
                Cipher Suite: TLS_ECDHE_ECDSA_WITH_RC4_128_SHA (0xc007)
                Cipher Suite: TLS_ECDH_RSA_WITH_RC4_128_SHA (0xc00c)
                Cipher Suite: TLS_ECDH_ECDSA_WITH_RC4_128_SHA (0xc002)
                Cipher Suite: TLS_RSA_WITH_RC4_128_SHA (0x0005)
                Cipher Suite: TLS_RSA_WITH_RC4_128_MD5 (0x0004)
                Cipher Suite: TLS_EMPTY_RENEGOTIATION_INFO_SCSV (0x00ff)
            Compression Methods Length: 1
            Compression Methods (1 method)
                Compression Method: null (0)
            Extensions Length: 29
            Extension: ec_point_formats
                Type: ec_point_formats (0x000b)
                Length: 4
                EC point formats Length: 3
                Elliptic curves point formats (3)
                    EC point format: uncompressed (0)
                    EC point format: ansiX962_compressed_prime (1)
                    EC point format: ansiX962_compressed_char2 (2)
            Extension: elliptic_curves
                Type: elliptic_curves (0x000a)
                Length: 8
                Elliptic Curves Length: 6
                Elliptic curves (3 curves)
                    Elliptic curve: secp521r1 (0x0019)
                    Elliptic curve: secp384r1 (0x0018)
                    Elliptic curve: secp256r1 (0x0017)
            Extension: SessionTicket TLS
                Type: SessionTicket TLS (0x0023)
                Length: 0
                Data (0 bytes)
            Extension: Heartbeat
                Type: Heartbeat (0x000f)
                Length: 1
                Mode: Peer allowed to send requests (1)

Frame 5: 68 bytes on wire (544 bits), 68 bytes captured (544 bits) on interface 0
    Interface id: 0
    Encapsulation type: Linux cooked-mode capture (25)
    Arrival Time: Oct 17, 2014 21:01:49.319696000 JST
    [Time shift for this packet: 0.000000000 seconds]
    Epoch Time: 1413547309.319696000 seconds
    [Time delta from previous captured frame: 0.000013000 seconds]
    [Time delta from previous displayed frame: 0.000013000 seconds]
    [Time since reference or first frame: 0.000189000 seconds]
    Frame Number: 5
    Frame Length: 68 bytes (544 bits)
    Capture Length: 68 bytes (544 bits)
    [Frame is marked: False]
    [Frame is ignored: False]
    [Protocols in frame: sll:ip:tcp]
Linux cooked capture
    Packet type: Unicast to us (0)
    Link-layer address type: 772
    Link-layer address length: 6
    Source: 00:00:00_00:00:00 (00:00:00:00:00:00)
    Protocol: IP (0x0800)
Internet Protocol Version 4, Src: 127.0.0.1 (127.0.0.1), Dst: 127.0.0.1 (127.0.0.1)
    Version: 4
    Header length: 20 bytes
    Differentiated Services Field: 0x00 (DSCP 0x00: Default; ECN: 0x00: Not-ECT (Not ECN-Capable Transport))
        0000 00.. = Differentiated Services Codepoint: Default (0x00)
        .... ..00 = Explicit Congestion Notification: Not-ECT (Not ECN-Capable Transport) (0x00)
    Total Length: 52
    Identification: 0x662f (26159)
    Flags: 0x02 (Don't Fragment)
        0... .... = Reserved bit: Not set
        .1.. .... = Don't fragment: Set
        ..0. .... = More fragments: Not set
    Fragment offset: 0
    Time to live: 64
    Protocol: TCP (6)
    Header checksum: 0xd692 [validation disabled]
        [Good: False]
        [Bad: False]
    Source: 127.0.0.1 (127.0.0.1)
    Destination: 127.0.0.1 (127.0.0.1)
    [Source GeoIP: Unknown]
    [Destination GeoIP: Unknown]
Transmission Control Protocol, Src Port: 5329 (5329), Dst Port: 35658 (35658), Seq: 1, Ack: 156, Len: 0
    Source port: 5329 (5329)
    Destination port: 35658 (35658)
    [Stream index: 0]
    Sequence number: 1    (relative sequence number)
    Acknowledgment number: 156    (relative ack number)
    Header length: 32 bytes
    Flags: 0x010 (ACK)
        000. .... .... = Reserved: Not set
        ...0 .... .... = Nonce: Not set
        .... 0... .... = Congestion Window Reduced (CWR): Not set
        .... .0.. .... = ECN-Echo: Not set
        .... ..0. .... = Urgent: Not set
        .... ...1 .... = Acknowledgment: Set
        .... .... 0... = Push: Not set
        .... .... .0.. = Reset: Not set
        .... .... ..0. = Syn: Not set
        .... .... ...0 = Fin: Not set
    Window size value: 350
    [Calculated window size: 44800]
    [Window size scaling factor: 128]
    Checksum: 0xfe28 [validation disabled]
        [Good Checksum: False]
        [Bad Checksum: False]
    Options: (12 bytes), No-Operation (NOP), No-Operation (NOP), Timestamps
        No-Operation (NOP)
            Type: 1
                0... .... = Copy on fragmentation: No
                .00. .... = Class: Control (0)
                ...0 0001 = Number: No-Operation (NOP) (1)
        No-Operation (NOP)
            Type: 1
                0... .... = Copy on fragmentation: No
                .00. .... = Class: Control (0)
                ...0 0001 = Number: No-Operation (NOP) (1)
        Timestamps: TSval 1613295, TSecr 1613295
            Kind: Timestamp (8)
            Length: 10
            Timestamp value: 1613295
            Timestamp echo reply: 1613295
    [SEQ/ACK analysis]
        [This is an ACK to the segment in frame: 4]
        [The RTT to ACK the segment was: 0.000013000 seconds]

Frame 6: 1025 bytes on wire (8200 bits), 1025 bytes captured (8200 bits) on interface 0
    Interface id: 0
    Encapsulation type: Linux cooked-mode capture (25)
    Arrival Time: Oct 17, 2014 21:01:49.319991000 JST
    [Time shift for this packet: 0.000000000 seconds]
    Epoch Time: 1413547309.319991000 seconds
    [Time delta from previous captured frame: 0.000295000 seconds]
    [Time delta from previous displayed frame: 0.000295000 seconds]
    [Time since reference or first frame: 0.000484000 seconds]
    Frame Number: 6
    Frame Length: 1025 bytes (8200 bits)
    Capture Length: 1025 bytes (8200 bits)
    [Frame is marked: False]
    [Frame is ignored: False]
    [Protocols in frame: sll:ip:tcp:ssl:pkcs-1:x509sat:x509sat:x509sat:x509sat:x509sat:x509sat:x509sat:x509sat:x509sat:x509sat:pkcs-1:pkcs-1]
Linux cooked capture
    Packet type: Unicast to us (0)
    Link-layer address type: 772
    Link-layer address length: 6
    Source: 00:00:00_00:00:00 (00:00:00:00:00:00)
    Protocol: IP (0x0800)
Internet Protocol Version 4, Src: 127.0.0.1 (127.0.0.1), Dst: 127.0.0.1 (127.0.0.1)
    Version: 4
    Header length: 20 bytes
    Differentiated Services Field: 0x00 (DSCP 0x00: Default; ECN: 0x00: Not-ECT (Not ECN-Capable Transport))
        0000 00.. = Differentiated Services Codepoint: Default (0x00)
        .... ..00 = Explicit Congestion Notification: Not-ECT (Not ECN-Capable Transport) (0x00)
    Total Length: 1009
    Identification: 0x6630 (26160)
    Flags: 0x02 (Don't Fragment)
        0... .... = Reserved bit: Not set
        .1.. .... = Don't fragment: Set
        ..0. .... = More fragments: Not set
    Fragment offset: 0
    Time to live: 64
    Protocol: TCP (6)
    Header checksum: 0xd2d4 [validation disabled]
        [Good: False]
        [Bad: False]
    Source: 127.0.0.1 (127.0.0.1)
    Destination: 127.0.0.1 (127.0.0.1)
    [Source GeoIP: Unknown]
    [Destination GeoIP: Unknown]
Transmission Control Protocol, Src Port: 5329 (5329), Dst Port: 35658 (35658), Seq: 1, Ack: 156, Len: 957
    Source port: 5329 (5329)
    Destination port: 35658 (35658)
    [Stream index: 0]
    Sequence number: 1    (relative sequence number)
    [Next sequence number: 958    (relative sequence number)]
    Acknowledgment number: 156    (relative ack number)
    Header length: 32 bytes
    Flags: 0x018 (PSH, ACK)
        000. .... .... = Reserved: Not set
        ...0 .... .... = Nonce: Not set
        .... 0... .... = Congestion Window Reduced (CWR): Not set
        .... .0.. .... = ECN-Echo: Not set
        .... ..0. .... = Urgent: Not set
        .... ...1 .... = Acknowledgment: Set
        .... .... 1... = Push: Set
        .... .... .0.. = Reset: Not set
        .... .... ..0. = Syn: Not set
        .... .... ...0 = Fin: Not set
    Window size value: 350
    [Calculated window size: 44800]
    [Window size scaling factor: 128]
    Checksum: 0x01e6 [validation disabled]
        [Good Checksum: False]
        [Bad Checksum: False]
    Options: (12 bytes), No-Operation (NOP), No-Operation (NOP), Timestamps
        No-Operation (NOP)
            Type: 1
                0... .... = Copy on fragmentation: No
                .00. .... = Class: Control (0)
                ...0 0001 = Number: No-Operation (NOP) (1)
        No-Operation (NOP)
            Type: 1
                0... .... = Copy on fragmentation: No
                .00. .... = Class: Control (0)
                ...0 0001 = Number: No-Operation (NOP) (1)
        Timestamps: TSval 1613296, TSecr 1613295
            Kind: Timestamp (8)
            Length: 10
            Timestamp value: 1613296
            Timestamp echo reply: 1613295
    [SEQ/ACK analysis]
        [Bytes in flight: 957]
Secure Sockets Layer
    TLSv1 Record Layer: Handshake Protocol: Server Hello
        Content Type: Handshake (22)
        Version: TLS 1.0 (0x0301)
        Length: 58
        Handshake Protocol: Server Hello
            Handshake Type: Server Hello (2)
            Length: 54
            Version: TLS 1.0 (0x0301)
            Random
                gmt_unix_time: Oct 17, 2014 21:01:49.000000000 JST
                random_bytes: 099c3c9462109e1b5c21b2bf59d33751bd0107d6a7a49e4c...
            Session ID Length: 0
            Cipher Suite: TLS_RSA_WITH_AES_256_CBC_SHA (0x0035)
            Compression Method: null (0)
            Extensions Length: 14
            Extension: renegotiation_info
                Type: renegotiation_info (0xff01)
                Length: 1
                Renegotiation Info extension
                    Renegotiation info extension length: 0
            Extension: SessionTicket TLS
                Type: SessionTicket TLS (0x0023)
                Length: 0
                Data (0 bytes)
            Extension: Heartbeat
                Type: Heartbeat (0x000f)
                Length: 1
                Mode: Peer allowed to send requests (1)
    TLSv1 Record Layer: Handshake Protocol: Certificate
        Content Type: Handshake (22)
        Version: TLS 1.0 (0x0301)
        Length: 880
        Handshake Protocol: Certificate
            Handshake Type: Certificate (11)
            Length: 876
            Certificates Length: 873
            Certificates (873 bytes)
                Certificate Length: 870
                Certificate (pkcs-9-at-emailAddress=nishidyatutokyo@gmail.com,id-at-organizationName=Default Company Ltd,id-at-localityName=,id-at-stateOrProvinceName=,id-at-countryName=JP)
                    signedCertificate
                        serialNumber : 0x008def4f48ee391f75
                        signature (shaWithRSAEncryption)
                            Algorithm Id: 1.2.840.113549.1.1.5 (shaWithRSAEncryption)
                        issuer: rdnSequence (0)
                            rdnSequence: 5 items (pkcs-9-at-emailAddress=nishidyatutokyo@gmail.com,id-at-organizationName=Default Company Ltd,id-at-localityName=,id-at-stateOrProvinceName=,id-at-countryName=JP)
                                RDNSequence item: 1 item (id-at-countryName=JP)
                                    RelativeDistinguishedName item (id-at-countryName=JP)
                                        Id: 2.5.4.6 (id-at-countryName)
                                        CountryName: JP
                                RDNSequence item: 1 item (id-at-stateOrProvinceName=)
                                    RelativeDistinguishedName item (id-at-stateOrProvinceName=)
                                        Id: 2.5.4.8 (id-at-stateOrProvinceName)
                                        DirectoryString: uTF8String (4)
                                            uTF8String: 
                                RDNSequence item: 1 item (id-at-localityName=)
                                    RelativeDistinguishedName item (id-at-localityName=)
                                        Id: 2.5.4.7 (id-at-localityName)
                                        DirectoryString: uTF8String (4)
                                            uTF8String: 
                                RDNSequence item: 1 item (id-at-organizationName=Default Company Ltd)
                                    RelativeDistinguishedName item (id-at-organizationName=Default Company Ltd)
                                        Id: 2.5.4.10 (id-at-organizationName)
                                        DirectoryString: uTF8String (4)
                                            uTF8String: Default Company Ltd
                                RDNSequence item: 1 item (pkcs-9-at-emailAddress=nishidyatutokyo@gmail.com)
                                    RelativeDistinguishedName item (pkcs-9-at-emailAddress=nishidyatutokyo@gmail.com)
                                        Id: 1.2.840.113549.1.9.1 (pkcs-9-at-emailAddress)
                                        IA5String: nishidyatutokyo@gmail.com
                        validity
                            notBefore: utcTime (0)
                                utcTime: 14-10-16 07:00:39 (UTC)
                            notAfter: utcTime (0)
                                utcTime: 24-10-13 07:00:39 (UTC)
                        subject: rdnSequence (0)
                            rdnSequence: 5 items (pkcs-9-at-emailAddress=nishidyatutokyo@gmail.com,id-at-organizationName=Default Company Ltd,id-at-localityName=,id-at-stateOrProvinceName=,id-at-countryName=JP)
                                RDNSequence item: 1 item (id-at-countryName=JP)
                                    RelativeDistinguishedName item (id-at-countryName=JP)
                                        Id: 2.5.4.6 (id-at-countryName)
                                        CountryName: JP
                                RDNSequence item: 1 item (id-at-stateOrProvinceName=)
                                    RelativeDistinguishedName item (id-at-stateOrProvinceName=)
                                        Id: 2.5.4.8 (id-at-stateOrProvinceName)
                                        DirectoryString: uTF8String (4)
                                            uTF8String: 
                                RDNSequence item: 1 item (id-at-localityName=)
                                    RelativeDistinguishedName item (id-at-localityName=)
                                        Id: 2.5.4.7 (id-at-localityName)
                                        DirectoryString: uTF8String (4)
                                            uTF8String: 
                                RDNSequence item: 1 item (id-at-organizationName=Default Company Ltd)
                                    RelativeDistinguishedName item (id-at-organizationName=Default Company Ltd)
                                        Id: 2.5.4.10 (id-at-organizationName)
                                        DirectoryString: uTF8String (4)
                                            uTF8String: Default Company Ltd
                                RDNSequence item: 1 item (pkcs-9-at-emailAddress=nishidyatutokyo@gmail.com)
                                    RelativeDistinguishedName item (pkcs-9-at-emailAddress=nishidyatutokyo@gmail.com)
                                        Id: 1.2.840.113549.1.9.1 (pkcs-9-at-emailAddress)
                                        IA5String: nishidyatutokyo@gmail.com
                        subjectPublicKeyInfo
                            algorithm (rsaEncryption)
                                Algorithm Id: 1.2.840.113549.1.1.1 (rsaEncryption)
                            Padding: 0
                            subjectPublicKey: 3082010a0282010100ecb1966c0dfb8811f593cdda0015e4...
                    algorithmIdentifier (shaWithRSAEncryption)
                        Algorithm Id: 1.2.840.113549.1.1.5 (shaWithRSAEncryption)
                    Padding: 0
                    encrypted: 17169fb73e08e584fe89d1969749720155a5bc6c5c14af7a...
    TLSv1 Record Layer: Handshake Protocol: Server Hello Done
        Content Type: Handshake (22)
        Version: TLS 1.0 (0x0301)
        Length: 4
        Handshake Protocol: Server Hello Done
            Handshake Type: Server Hello Done (14)
            Length: 0

Frame 7: 68 bytes on wire (544 bits), 68 bytes captured (544 bits) on interface 0
    Interface id: 0
    Encapsulation type: Linux cooked-mode capture (25)
    Arrival Time: Oct 17, 2014 21:01:49.320129000 JST
    [Time shift for this packet: 0.000000000 seconds]
    Epoch Time: 1413547309.320129000 seconds
    [Time delta from previous captured frame: 0.000138000 seconds]
    [Time delta from previous displayed frame: 0.000138000 seconds]
    [Time since reference or first frame: 0.000622000 seconds]
    Frame Number: 7
    Frame Length: 68 bytes (544 bits)
    Capture Length: 68 bytes (544 bits)
    [Frame is marked: False]
    [Frame is ignored: False]
    [Protocols in frame: sll:ip:tcp]
Linux cooked capture
    Packet type: Unicast to us (0)
    Link-layer address type: 772
    Link-layer address length: 6
    Source: 00:00:00_00:00:00 (00:00:00:00:00:00)
    Protocol: IP (0x0800)
Internet Protocol Version 4, Src: 127.0.0.1 (127.0.0.1), Dst: 127.0.0.1 (127.0.0.1)
    Version: 4
    Header length: 20 bytes
    Differentiated Services Field: 0x00 (DSCP 0x00: Default; ECN: 0x00: Not-ECT (Not ECN-Capable Transport))
        0000 00.. = Differentiated Services Codepoint: Default (0x00)
        .... ..00 = Explicit Congestion Notification: Not-ECT (Not ECN-Capable Transport) (0x00)
    Total Length: 52
    Identification: 0xbab6 (47798)
    Flags: 0x02 (Don't Fragment)
        0... .... = Reserved bit: Not set
        .1.. .... = Don't fragment: Set
        ..0. .... = More fragments: Not set
    Fragment offset: 0
    Time to live: 64
    Protocol: TCP (6)
    Header checksum: 0x820b [validation disabled]
        [Good: False]
        [Bad: False]
    Source: 127.0.0.1 (127.0.0.1)
    Destination: 127.0.0.1 (127.0.0.1)
    [Source GeoIP: Unknown]
    [Destination GeoIP: Unknown]
Transmission Control Protocol, Src Port: 35658 (35658), Dst Port: 5329 (5329), Seq: 156, Ack: 958, Len: 0
    Source port: 35658 (35658)
    Destination port: 5329 (5329)
    [Stream index: 0]
    Sequence number: 156    (relative sequence number)
    Acknowledgment number: 958    (relative ack number)
    Header length: 32 bytes
    Flags: 0x010 (ACK)
        000. .... .... = Reserved: Not set
        ...0 .... .... = Nonce: Not set
        .... 0... .... = Congestion Window Reduced (CWR): Not set
        .... .0.. .... = ECN-Echo: Not set
        .... ..0. .... = Urgent: Not set
        .... ...1 .... = Acknowledgment: Set
        .... .... 0... = Push: Not set
        .... .... .0.. = Reset: Not set
        .... .... ..0. = Syn: Not set
        .... .... ...0 = Fin: Not set
    Window size value: 357
    [Calculated window size: 45696]
    [Window size scaling factor: 128]
    Checksum: 0xfe28 [validation disabled]
        [Good Checksum: False]
        [Bad Checksum: False]
    Options: (12 bytes), No-Operation (NOP), No-Operation (NOP), Timestamps
        No-Operation (NOP)
            Type: 1
                0... .... = Copy on fragmentation: No
                .00. .... = Class: Control (0)
                ...0 0001 = Number: No-Operation (NOP) (1)
        No-Operation (NOP)
            Type: 1
                0... .... = Copy on fragmentation: No
                .00. .... = Class: Control (0)
                ...0 0001 = Number: No-Operation (NOP) (1)
        Timestamps: TSval 1613296, TSecr 1613296
            Kind: Timestamp (8)
            Length: 10
            Timestamp value: 1613296
            Timestamp echo reply: 1613296
    [SEQ/ACK analysis]
        [This is an ACK to the segment in frame: 6]
        [The RTT to ACK the segment was: 0.000138000 seconds]

Frame 8: 394 bytes on wire (3152 bits), 394 bytes captured (3152 bits) on interface 0
    Interface id: 0
    Encapsulation type: Linux cooked-mode capture (25)
    Arrival Time: Oct 17, 2014 21:01:49.320452000 JST
    [Time shift for this packet: 0.000000000 seconds]
    Epoch Time: 1413547309.320452000 seconds
    [Time delta from previous captured frame: 0.000323000 seconds]
    [Time delta from previous displayed frame: 0.000323000 seconds]
    [Time since reference or first frame: 0.000945000 seconds]
    Frame Number: 8
    Frame Length: 394 bytes (3152 bits)
    Capture Length: 394 bytes (3152 bits)
    [Frame is marked: False]
    [Frame is ignored: False]
    [Protocols in frame: sll:ip:tcp:ssl]
Linux cooked capture
    Packet type: Unicast to us (0)
    Link-layer address type: 772
    Link-layer address length: 6
    Source: 00:00:00_00:00:00 (00:00:00:00:00:00)
    Protocol: IP (0x0800)
Internet Protocol Version 4, Src: 127.0.0.1 (127.0.0.1), Dst: 127.0.0.1 (127.0.0.1)
    Version: 4
    Header length: 20 bytes
    Differentiated Services Field: 0x00 (DSCP 0x00: Default; ECN: 0x00: Not-ECT (Not ECN-Capable Transport))
        0000 00.. = Differentiated Services Codepoint: Default (0x00)
        .... ..00 = Explicit Congestion Notification: Not-ECT (Not ECN-Capable Transport) (0x00)
    Total Length: 378
    Identification: 0xbab7 (47799)
    Flags: 0x02 (Don't Fragment)
        0... .... = Reserved bit: Not set
        .1.. .... = Don't fragment: Set
        ..0. .... = More fragments: Not set
    Fragment offset: 0
    Time to live: 64
    Protocol: TCP (6)
    Header checksum: 0x80c4 [validation disabled]
        [Good: False]
        [Bad: False]
    Source: 127.0.0.1 (127.0.0.1)
    Destination: 127.0.0.1 (127.0.0.1)
    [Source GeoIP: Unknown]
    [Destination GeoIP: Unknown]
Transmission Control Protocol, Src Port: 35658 (35658), Dst Port: 5329 (5329), Seq: 156, Ack: 958, Len: 326
    Source port: 35658 (35658)
    Destination port: 5329 (5329)
    [Stream index: 0]
    Sequence number: 156    (relative sequence number)
    [Next sequence number: 482    (relative sequence number)]
    Acknowledgment number: 958    (relative ack number)
    Header length: 32 bytes
    Flags: 0x018 (PSH, ACK)
        000. .... .... = Reserved: Not set
        ...0 .... .... = Nonce: Not set
        .... 0... .... = Congestion Window Reduced (CWR): Not set
        .... .0.. .... = ECN-Echo: Not set
        .... ..0. .... = Urgent: Not set
        .... ...1 .... = Acknowledgment: Set
        .... .... 1... = Push: Set
        .... .... .0.. = Reset: Not set
        .... .... ..0. = Syn: Not set
        .... .... ...0 = Fin: Not set
    Window size value: 357
    [Calculated window size: 45696]
    [Window size scaling factor: 128]
    Checksum: 0xff6e [validation disabled]
        [Good Checksum: False]
        [Bad Checksum: False]
    Options: (12 bytes), No-Operation (NOP), No-Operation (NOP), Timestamps
        No-Operation (NOP)
            Type: 1
                0... .... = Copy on fragmentation: No
                .00. .... = Class: Control (0)
                ...0 0001 = Number: No-Operation (NOP) (1)
        No-Operation (NOP)
            Type: 1
                0... .... = Copy on fragmentation: No
                .00. .... = Class: Control (0)
                ...0 0001 = Number: No-Operation (NOP) (1)
        Timestamps: TSval 1613296, TSecr 1613296
            Kind: Timestamp (8)
            Length: 10
            Timestamp value: 1613296
            Timestamp echo reply: 1613296
    [SEQ/ACK analysis]
        [Bytes in flight: 326]
Secure Sockets Layer
    TLSv1 Record Layer: Handshake Protocol: Client Key Exchange
        Content Type: Handshake (22)
        Version: TLS 1.0 (0x0301)
        Length: 262
        Handshake Protocol: Client Key Exchange
            Handshake Type: Client Key Exchange (16)
            Length: 258
            RSA Encrypted PreMaster Secret
                Encrypted PreMaster length: 256
                Encrypted PreMaster: 09f8f8871dc784b7397ed7460d250b36f8ea275bb43912ce...
    TLSv1 Record Layer: Change Cipher Spec Protocol: Change Cipher Spec
        Content Type: Change Cipher Spec (20)
        Version: TLS 1.0 (0x0301)
        Length: 1
        Change Cipher Spec Message
    TLSv1 Record Layer: Handshake Protocol: Encrypted Handshake Message
        Content Type: Handshake (22)
        Version: TLS 1.0 (0x0301)
        Length: 48
        Handshake Protocol: Encrypted Handshake Message

Frame 9: 302 bytes on wire (2416 bits), 302 bytes captured (2416 bits) on interface 0
    Interface id: 0
    Encapsulation type: Linux cooked-mode capture (25)
    Arrival Time: Oct 17, 2014 21:01:49.324173000 JST
    [Time shift for this packet: 0.000000000 seconds]
    Epoch Time: 1413547309.324173000 seconds
    [Time delta from previous captured frame: 0.003721000 seconds]
    [Time delta from previous displayed frame: 0.003721000 seconds]
    [Time since reference or first frame: 0.004666000 seconds]
    Frame Number: 9
    Frame Length: 302 bytes (2416 bits)
    Capture Length: 302 bytes (2416 bits)
    [Frame is marked: False]
    [Frame is ignored: False]
    [Protocols in frame: sll:ip:tcp:ssl]
Linux cooked capture
    Packet type: Unicast to us (0)
    Link-layer address type: 772
    Link-layer address length: 6
    Source: 00:00:00_00:00:00 (00:00:00:00:00:00)
    Protocol: IP (0x0800)
Internet Protocol Version 4, Src: 127.0.0.1 (127.0.0.1), Dst: 127.0.0.1 (127.0.0.1)
    Version: 4
    Header length: 20 bytes
    Differentiated Services Field: 0x00 (DSCP 0x00: Default; ECN: 0x00: Not-ECT (Not ECN-Capable Transport))
        0000 00.. = Differentiated Services Codepoint: Default (0x00)
        .... ..00 = Explicit Congestion Notification: Not-ECT (Not ECN-Capable Transport) (0x00)
    Total Length: 286
    Identification: 0x6631 (26161)
    Flags: 0x02 (Don't Fragment)
        0... .... = Reserved bit: Not set
        .1.. .... = Don't fragment: Set
        ..0. .... = More fragments: Not set
    Fragment offset: 0
    Time to live: 64
    Protocol: TCP (6)
    Header checksum: 0xd5a6 [validation disabled]
        [Good: False]
        [Bad: False]
    Source: 127.0.0.1 (127.0.0.1)
    Destination: 127.0.0.1 (127.0.0.1)
    [Source GeoIP: Unknown]
    [Destination GeoIP: Unknown]
Transmission Control Protocol, Src Port: 5329 (5329), Dst Port: 35658 (35658), Seq: 958, Ack: 482, Len: 234
    Source port: 5329 (5329)
    Destination port: 35658 (35658)
    [Stream index: 0]
    Sequence number: 958    (relative sequence number)
    [Next sequence number: 1192    (relative sequence number)]
    Acknowledgment number: 482    (relative ack number)
    Header length: 32 bytes
    Flags: 0x018 (PSH, ACK)
        000. .... .... = Reserved: Not set
        ...0 .... .... = Nonce: Not set
        .... 0... .... = Congestion Window Reduced (CWR): Not set
        .... .0.. .... = ECN-Echo: Not set
        .... ..0. .... = Urgent: Not set
        .... ...1 .... = Acknowledgment: Set
        .... .... 1... = Push: Set
        .... .... .0.. = Reset: Not set
        .... .... ..0. = Syn: Not set
        .... .... ...0 = Fin: Not set
    Window size value: 359
    [Calculated window size: 45952]
    [Window size scaling factor: 128]
    Checksum: 0xff12 [validation disabled]
        [Good Checksum: False]
        [Bad Checksum: False]
    Options: (12 bytes), No-Operation (NOP), No-Operation (NOP), Timestamps
        No-Operation (NOP)
            Type: 1
                0... .... = Copy on fragmentation: No
                .00. .... = Class: Control (0)
                ...0 0001 = Number: No-Operation (NOP) (1)
        No-Operation (NOP)
            Type: 1
                0... .... = Copy on fragmentation: No
                .00. .... = Class: Control (0)
                ...0 0001 = Number: No-Operation (NOP) (1)
        Timestamps: TSval 1613300, TSecr 1613296
            Kind: Timestamp (8)
            Length: 10
            Timestamp value: 1613300
            Timestamp echo reply: 1613296
    [SEQ/ACK analysis]
        [This is an ACK to the segment in frame: 8]
        [The RTT to ACK the segment was: 0.003721000 seconds]
        [Bytes in flight: 234]
Secure Sockets Layer
    TLSv1 Record Layer: Handshake Protocol: New Session Ticket
        Content Type: Handshake (22)
        Version: TLS 1.0 (0x0301)
        Length: 170
        Handshake Protocol: New Session Ticket
            Handshake Type: New Session Ticket (4)
            Length: 166
            TLS Session Ticket
                Session Ticket Lifetime Hint: 7200
                Session Ticket Length: 160
                Session Ticket: 33fe10a98bcb4d90697a5a4a1182fef222fbec1d9e3b9b59...
    TLSv1 Record Layer: Change Cipher Spec Protocol: Change Cipher Spec
        Content Type: Change Cipher Spec (20)
        Version: TLS 1.0 (0x0301)
        Length: 1
        Change Cipher Spec Message
    TLSv1 Record Layer: Handshake Protocol: Encrypted Handshake Message
        Content Type: Handshake (22)
        Version: TLS 1.0 (0x0301)
        Length: 48
        Handshake Protocol: Encrypted Handshake Message

Frame 10: 6606 bytes on wire (52848 bits), 6606 bytes captured (52848 bits) on interface 0
    Interface id: 0
    Encapsulation type: Linux cooked-mode capture (25)
    Arrival Time: Oct 17, 2014 21:01:49.324637000 JST
    [Time shift for this packet: 0.000000000 seconds]
    Epoch Time: 1413547309.324637000 seconds
    [Time delta from previous captured frame: 0.000464000 seconds]
    [Time delta from previous displayed frame: 0.000464000 seconds]
    [Time since reference or first frame: 0.005130000 seconds]
    Frame Number: 10
    Frame Length: 6606 bytes (52848 bits)
    Capture Length: 6606 bytes (52848 bits)
    [Frame is marked: False]
    [Frame is ignored: False]
    [Protocols in frame: sll:ip:tcp:ssl]
Linux cooked capture
    Packet type: Unicast to us (0)
    Link-layer address type: 772
    Link-layer address length: 6
    Source: 00:00:00_00:00:00 (00:00:00:00:00:00)
    Protocol: IP (0x0800)
Internet Protocol Version 4, Src: 127.0.0.1 (127.0.0.1), Dst: 127.0.0.1 (127.0.0.1)
    Version: 4
    Header length: 20 bytes
    Differentiated Services Field: 0x00 (DSCP 0x00: Default; ECN: 0x00: Not-ECT (Not ECN-Capable Transport))
        0000 00.. = Differentiated Services Codepoint: Default (0x00)
        .... ..00 = Explicit Congestion Notification: Not-ECT (Not ECN-Capable Transport) (0x00)
    Total Length: 6590
    Identification: 0xbab8 (47800)
    Flags: 0x02 (Don't Fragment)
        0... .... = Reserved bit: Not set
        .1.. .... = Don't fragment: Set
        ..0. .... = More fragments: Not set
    Fragment offset: 0
    Time to live: 64
    Protocol: TCP (6)
    Header checksum: 0x687f [validation disabled]
        [Good: False]
        [Bad: False]
    Source: 127.0.0.1 (127.0.0.1)
    Destination: 127.0.0.1 (127.0.0.1)
    [Source GeoIP: Unknown]
    [Destination GeoIP: Unknown]
Transmission Control Protocol, Src Port: 35658 (35658), Dst Port: 5329 (5329), Seq: 482, Ack: 1192, Len: 6538
    Source port: 35658 (35658)
    Destination port: 5329 (5329)
    [Stream index: 0]
    Sequence number: 482    (relative sequence number)
    [Next sequence number: 7020    (relative sequence number)]
    Acknowledgment number: 1192    (relative ack number)
    Header length: 32 bytes
    Flags: 0x018 (PSH, ACK)
        000. .... .... = Reserved: Not set
        ...0 .... .... = Nonce: Not set
        .... 0... .... = Congestion Window Reduced (CWR): Not set
        .... .0.. .... = ECN-Echo: Not set
        .... ..0. .... = Urgent: Not set
        .... ...1 .... = Acknowledgment: Set
        .... .... 1... = Push: Set
        .... .... .0.. = Reset: Not set
        .... .... ..0. = Syn: Not set
        .... .... ...0 = Fin: Not set
    Window size value: 372
    [Calculated window size: 47616]
    [Window size scaling factor: 128]
    Checksum: 0x17b3 [validation disabled]
        [Good Checksum: False]
        [Bad Checksum: False]
    Options: (12 bytes), No-Operation (NOP), No-Operation (NOP), Timestamps
        No-Operation (NOP)
            Type: 1
                0... .... = Copy on fragmentation: No
                .00. .... = Class: Control (0)
                ...0 0001 = Number: No-Operation (NOP) (1)
        No-Operation (NOP)
            Type: 1
                0... .... = Copy on fragmentation: No
                .00. .... = Class: Control (0)
                ...0 0001 = Number: No-Operation (NOP) (1)
        Timestamps: TSval 1613300, TSecr 1613300
            Kind: Timestamp (8)
            Length: 10
            Timestamp value: 1613300
            Timestamp echo reply: 1613300
    [SEQ/ACK analysis]
        [This is an ACK to the segment in frame: 9]
        [The RTT to ACK the segment was: 0.000464000 seconds]
        [Bytes in flight: 6538]
Secure Sockets Layer
    TLSv1 Record Layer: Application Data Protocol: Application Data
        Content Type: Application Data (23)
        Version: TLS 1.0 (0x0301)
        Length: 32
        Encrypted Application Data: d6cad9c8b16bc07df1d28d5fe904e4bb37e4c8b868eeab85...
    TLSv1 Record Layer: Application Data Protocol: Application Data
        Content Type: Application Data (23)
        Version: TLS 1.0 (0x0301)
        Length: 6496
        Encrypted Application Data: 5b0fe3d81656b9e692cb30c76f69a0296623a386f3ec9f68...

Frame 11: 68 bytes on wire (544 bits), 68 bytes captured (544 bits) on interface 0
    Interface id: 0
    Encapsulation type: Linux cooked-mode capture (25)
    Arrival Time: Oct 17, 2014 21:01:49.324702000 JST
    [Time shift for this packet: 0.000000000 seconds]
    Epoch Time: 1413547309.324702000 seconds
    [Time delta from previous captured frame: 0.000065000 seconds]
    [Time delta from previous displayed frame: 0.000065000 seconds]
    [Time since reference or first frame: 0.005195000 seconds]
    Frame Number: 11
    Frame Length: 68 bytes (544 bits)
    Capture Length: 68 bytes (544 bits)
    [Frame is marked: False]
    [Frame is ignored: False]
    [Protocols in frame: sll:ip:tcp]
Linux cooked capture
    Packet type: Unicast to us (0)
    Link-layer address type: 772
    Link-layer address length: 6
    Source: 00:00:00_00:00:00 (00:00:00:00:00:00)
    Protocol: IP (0x0800)
Internet Protocol Version 4, Src: 127.0.0.1 (127.0.0.1), Dst: 127.0.0.1 (127.0.0.1)
    Version: 4
    Header length: 20 bytes
    Differentiated Services Field: 0x00 (DSCP 0x00: Default; ECN: 0x00: Not-ECT (Not ECN-Capable Transport))
        0000 00.. = Differentiated Services Codepoint: Default (0x00)
        .... ..00 = Explicit Congestion Notification: Not-ECT (Not ECN-Capable Transport) (0x00)
    Total Length: 52
    Identification: 0x6632 (26162)
    Flags: 0x02 (Don't Fragment)
        0... .... = Reserved bit: Not set
        .1.. .... = Don't fragment: Set
        ..0. .... = More fragments: Not set
    Fragment offset: 0
    Time to live: 64
    Protocol: TCP (6)
    Header checksum: 0xd68f [validation disabled]
        [Good: False]
        [Bad: False]
    Source: 127.0.0.1 (127.0.0.1)
    Destination: 127.0.0.1 (127.0.0.1)
    [Source GeoIP: Unknown]
    [Destination GeoIP: Unknown]
Transmission Control Protocol, Src Port: 5329 (5329), Dst Port: 35658 (35658), Seq: 1192, Ack: 7020, Len: 0
    Source port: 5329 (5329)
    Destination port: 35658 (35658)
    [Stream index: 0]
    Sequence number: 1192    (relative sequence number)
    Acknowledgment number: 7020    (relative ack number)
    Header length: 32 bytes
    Flags: 0x010 (ACK)
        000. .... .... = Reserved: Not set
        ...0 .... .... = Nonce: Not set
        .... 0... .... = Congestion Window Reduced (CWR): Not set
        .... .0.. .... = ECN-Echo: Not set
        .... ..0. .... = Urgent: Not set
        .... ...1 .... = Acknowledgment: Set
        .... .... 0... = Push: Not set
        .... .... .0.. = Reset: Not set
        .... .... ..0. = Syn: Not set
        .... .... ...0 = Fin: Not set
    Window size value: 1382
    [Calculated window size: 176896]
    [Window size scaling factor: 128]
    Checksum: 0xfe28 [validation disabled]
        [Good Checksum: False]
        [Bad Checksum: False]
    Options: (12 bytes), No-Operation (NOP), No-Operation (NOP), Timestamps
        No-Operation (NOP)
            Type: 1
                0... .... = Copy on fragmentation: No
                .00. .... = Class: Control (0)
                ...0 0001 = Number: No-Operation (NOP) (1)
        No-Operation (NOP)
            Type: 1
                0... .... = Copy on fragmentation: No
                .00. .... = Class: Control (0)
                ...0 0001 = Number: No-Operation (NOP) (1)
        Timestamps: TSval 1613300, TSecr 1613300
            Kind: Timestamp (8)
            Length: 10
            Timestamp value: 1613300
            Timestamp echo reply: 1613300
    [SEQ/ACK analysis]
        [This is an ACK to the segment in frame: 10]
        [The RTT to ACK the segment was: 0.000065000 seconds]

Frame 12: 670 bytes on wire (5360 bits), 670 bytes captured (5360 bits) on interface 0
    Interface id: 0
    Encapsulation type: Linux cooked-mode capture (25)
    Arrival Time: Oct 17, 2014 21:01:50.551871000 JST
    [Time shift for this packet: 0.000000000 seconds]
    Epoch Time: 1413547310.551871000 seconds
    [Time delta from previous captured frame: 1.227169000 seconds]
    [Time delta from previous displayed frame: 1.227169000 seconds]
    [Time since reference or first frame: 1.232364000 seconds]
    Frame Number: 12
    Frame Length: 670 bytes (5360 bits)
    Capture Length: 670 bytes (5360 bits)
    [Frame is marked: False]
    [Frame is ignored: False]
    [Protocols in frame: sll:ip:tcp:ssl]
Linux cooked capture
    Packet type: Unicast to us (0)
    Link-layer address type: 772
    Link-layer address length: 6
    Source: 00:00:00_00:00:00 (00:00:00:00:00:00)
    Protocol: IP (0x0800)
Internet Protocol Version 4, Src: 127.0.0.1 (127.0.0.1), Dst: 127.0.0.1 (127.0.0.1)
    Version: 4
    Header length: 20 bytes
    Differentiated Services Field: 0x00 (DSCP 0x00: Default; ECN: 0x00: Not-ECT (Not ECN-Capable Transport))
        0000 00.. = Differentiated Services Codepoint: Default (0x00)
        .... ..00 = Explicit Congestion Notification: Not-ECT (Not ECN-Capable Transport) (0x00)
    Total Length: 654
    Identification: 0x6633 (26163)
    Flags: 0x02 (Don't Fragment)
        0... .... = Reserved bit: Not set
        .1.. .... = Don't fragment: Set
        ..0. .... = More fragments: Not set
    Fragment offset: 0
    Time to live: 64
    Protocol: TCP (6)
    Header checksum: 0xd434 [validation disabled]
        [Good: False]
        [Bad: False]
    Source: 127.0.0.1 (127.0.0.1)
    Destination: 127.0.0.1 (127.0.0.1)
    [Source GeoIP: Unknown]
    [Destination GeoIP: Unknown]
Transmission Control Protocol, Src Port: 5329 (5329), Dst Port: 35658 (35658), Seq: 1192, Ack: 7020, Len: 602
    Source port: 5329 (5329)
    Destination port: 35658 (35658)
    [Stream index: 0]
    Sequence number: 1192    (relative sequence number)
    [Next sequence number: 1794    (relative sequence number)]
    Acknowledgment number: 7020    (relative ack number)
    Header length: 32 bytes
    Flags: 0x018 (PSH, ACK)
        000. .... .... = Reserved: Not set
        ...0 .... .... = Nonce: Not set
        .... 0... .... = Congestion Window Reduced (CWR): Not set
        .... .0.. .... = ECN-Echo: Not set
        .... ..0. .... = Urgent: Not set
        .... ...1 .... = Acknowledgment: Set
        .... .... 1... = Push: Set
        .... .... .0.. = Reset: Not set
        .... .... ..0. = Syn: Not set
        .... .... ...0 = Fin: Not set
    Window size value: 1382
    [Calculated window size: 176896]
    [Window size scaling factor: 128]
    Checksum: 0x0083 [validation disabled]
        [Good Checksum: False]
        [Bad Checksum: False]
    Options: (12 bytes), No-Operation (NOP), No-Operation (NOP), Timestamps
        No-Operation (NOP)
            Type: 1
                0... .... = Copy on fragmentation: No
                .00. .... = Class: Control (0)
                ...0 0001 = Number: No-Operation (NOP) (1)
        No-Operation (NOP)
            Type: 1
                0... .... = Copy on fragmentation: No
                .00. .... = Class: Control (0)
                ...0 0001 = Number: No-Operation (NOP) (1)
        Timestamps: TSval 1614527, TSecr 1613300
            Kind: Timestamp (8)
            Length: 10
            Timestamp value: 1614527
            Timestamp echo reply: 1613300
    [SEQ/ACK analysis]
        [Bytes in flight: 602]
Secure Sockets Layer
    TLSv1 Record Layer: Application Data Protocol: Application Data
        Content Type: Application Data (23)
        Version: TLS 1.0 (0x0301)
        Length: 32
        Encrypted Application Data: ac30fd1e8f3045c4886edd106daf12ee5b0a873aec012987...
    TLSv1 Record Layer: Application Data Protocol: Application Data
        Content Type: Application Data (23)
        Version: TLS 1.0 (0x0301)
        Length: 560
        Encrypted Application Data: d17635be2d2e7e724768c12776bdc015d9522b66a0ce0e26...

Frame 13: 68 bytes on wire (544 bits), 68 bytes captured (544 bits) on interface 0
    Interface id: 0
    Encapsulation type: Linux cooked-mode capture (25)
    Arrival Time: Oct 17, 2014 21:01:50.552195000 JST
    [Time shift for this packet: 0.000000000 seconds]
    Epoch Time: 1413547310.552195000 seconds
    [Time delta from previous captured frame: 0.000324000 seconds]
    [Time delta from previous displayed frame: 0.000324000 seconds]
    [Time since reference or first frame: 1.232688000 seconds]
    Frame Number: 13
    Frame Length: 68 bytes (544 bits)
    Capture Length: 68 bytes (544 bits)
    [Frame is marked: False]
    [Frame is ignored: False]
    [Protocols in frame: sll:ip:tcp]
Linux cooked capture
    Packet type: Unicast to us (0)
    Link-layer address type: 772
    Link-layer address length: 6
    Source: 00:00:00_00:00:00 (00:00:00:00:00:00)
    Protocol: IP (0x0800)
Internet Protocol Version 4, Src: 127.0.0.1 (127.0.0.1), Dst: 127.0.0.1 (127.0.0.1)
    Version: 4
    Header length: 20 bytes
    Differentiated Services Field: 0x00 (DSCP 0x00: Default; ECN: 0x00: Not-ECT (Not ECN-Capable Transport))
        0000 00.. = Differentiated Services Codepoint: Default (0x00)
        .... ..00 = Explicit Congestion Notification: Not-ECT (Not ECN-Capable Transport) (0x00)
    Total Length: 52
    Identification: 0xbab9 (47801)
    Flags: 0x02 (Don't Fragment)
        0... .... = Reserved bit: Not set
        .1.. .... = Don't fragment: Set
        ..0. .... = More fragments: Not set
    Fragment offset: 0
    Time to live: 64
    Protocol: TCP (6)
    Header checksum: 0x8208 [validation disabled]
        [Good: False]
        [Bad: False]
    Source: 127.0.0.1 (127.0.0.1)
    Destination: 127.0.0.1 (127.0.0.1)
    [Source GeoIP: Unknown]
    [Destination GeoIP: Unknown]
Transmission Control Protocol, Src Port: 35658 (35658), Dst Port: 5329 (5329), Seq: 7020, Ack: 1794, Len: 0
    Source port: 35658 (35658)
    Destination port: 5329 (5329)
    [Stream index: 0]
    Sequence number: 7020    (relative sequence number)
    Acknowledgment number: 1794    (relative ack number)
    Header length: 32 bytes
    Flags: 0x011 (FIN, ACK)
        000. .... .... = Reserved: Not set
        ...0 .... .... = Nonce: Not set
        .... 0... .... = Congestion Window Reduced (CWR): Not set
        .... .0.. .... = ECN-Echo: Not set
        .... ..0. .... = Urgent: Not set
        .... ...1 .... = Acknowledgment: Set
        .... .... 0... = Push: Not set
        .... .... .0.. = Reset: Not set
        .... .... ..0. = Syn: Not set
        .... .... ...1 = Fin: Set
            [Expert Info (Chat/Sequence): Connection finish (FIN)]
                [Message: Connection finish (FIN)]
                [Severity level: Chat]
                [Group: Sequence]
    Window size value: 387
    [Calculated window size: 49536]
    [Window size scaling factor: 128]
    Checksum: 0xfe28 [validation disabled]
        [Good Checksum: False]
        [Bad Checksum: False]
    Options: (12 bytes), No-Operation (NOP), No-Operation (NOP), Timestamps
        No-Operation (NOP)
            Type: 1
                0... .... = Copy on fragmentation: No
                .00. .... = Class: Control (0)
                ...0 0001 = Number: No-Operation (NOP) (1)
        No-Operation (NOP)
            Type: 1
                0... .... = Copy on fragmentation: No
                .00. .... = Class: Control (0)
                ...0 0001 = Number: No-Operation (NOP) (1)
        Timestamps: TSval 1614528, TSecr 1614527
            Kind: Timestamp (8)
            Length: 10
            Timestamp value: 1614528
            Timestamp echo reply: 1614527
    [SEQ/ACK analysis]
        [This is an ACK to the segment in frame: 12]
        [The RTT to ACK the segment was: 0.000324000 seconds]

Frame 14: 68 bytes on wire (544 bits), 68 bytes captured (544 bits) on interface 0
    Interface id: 0
    Encapsulation type: Linux cooked-mode capture (25)
    Arrival Time: Oct 17, 2014 21:01:50.553836000 JST
    [Time shift for this packet: 0.000000000 seconds]
    Epoch Time: 1413547310.553836000 seconds
    [Time delta from previous captured frame: 0.001641000 seconds]
    [Time delta from previous displayed frame: 0.001641000 seconds]
    [Time since reference or first frame: 1.234329000 seconds]
    Frame Number: 14
    Frame Length: 68 bytes (544 bits)
    Capture Length: 68 bytes (544 bits)
    [Frame is marked: False]
    [Frame is ignored: False]
    [Protocols in frame: sll:ip:tcp]
Linux cooked capture
    Packet type: Unicast to us (0)
    Link-layer address type: 772
    Link-layer address length: 6
    Source: 00:00:00_00:00:00 (00:00:00:00:00:00)
    Protocol: IP (0x0800)
Internet Protocol Version 4, Src: 127.0.0.1 (127.0.0.1), Dst: 127.0.0.1 (127.0.0.1)
    Version: 4
    Header length: 20 bytes
    Differentiated Services Field: 0x00 (DSCP 0x00: Default; ECN: 0x00: Not-ECT (Not ECN-Capable Transport))
        0000 00.. = Differentiated Services Codepoint: Default (0x00)
        .... ..00 = Explicit Congestion Notification: Not-ECT (Not ECN-Capable Transport) (0x00)
    Total Length: 52
    Identification: 0x6634 (26164)
    Flags: 0x02 (Don't Fragment)
        0... .... = Reserved bit: Not set
        .1.. .... = Don't fragment: Set
        ..0. .... = More fragments: Not set
    Fragment offset: 0
    Time to live: 64
    Protocol: TCP (6)
    Header checksum: 0xd68d [validation disabled]
        [Good: False]
        [Bad: False]
    Source: 127.0.0.1 (127.0.0.1)
    Destination: 127.0.0.1 (127.0.0.1)
    [Source GeoIP: Unknown]
    [Destination GeoIP: Unknown]
Transmission Control Protocol, Src Port: 5329 (5329), Dst Port: 35658 (35658), Seq: 1794, Ack: 7021, Len: 0
    Source port: 5329 (5329)
    Destination port: 35658 (35658)
    [Stream index: 0]
    Sequence number: 1794    (relative sequence number)
    Acknowledgment number: 7021    (relative ack number)
    Header length: 32 bytes
    Flags: 0x011 (FIN, ACK)
        000. .... .... = Reserved: Not set
        ...0 .... .... = Nonce: Not set
        .... 0... .... = Congestion Window Reduced (CWR): Not set
        .... .0.. .... = ECN-Echo: Not set
        .... ..0. .... = Urgent: Not set
        .... ...1 .... = Acknowledgment: Set
        .... .... 0... = Push: Not set
        .... .... .0.. = Reset: Not set
        .... .... ..0. = Syn: Not set
        .... .... ...1 = Fin: Set
            [Expert Info (Chat/Sequence): Connection finish (FIN)]
                [Message: Connection finish (FIN)]
                [Severity level: Chat]
                [Group: Sequence]
    Window size value: 1382
    [Calculated window size: 176896]
    [Window size scaling factor: 128]
    Checksum: 0xfe28 [validation disabled]
        [Good Checksum: False]
        [Bad Checksum: False]
    Options: (12 bytes), No-Operation (NOP), No-Operation (NOP), Timestamps
        No-Operation (NOP)
            Type: 1
                0... .... = Copy on fragmentation: No
                .00. .... = Class: Control (0)
                ...0 0001 = Number: No-Operation (NOP) (1)
        No-Operation (NOP)
            Type: 1
                0... .... = Copy on fragmentation: No
                .00. .... = Class: Control (0)
                ...0 0001 = Number: No-Operation (NOP) (1)
        Timestamps: TSval 1614529, TSecr 1614528
            Kind: Timestamp (8)
            Length: 10
            Timestamp value: 1614529
            Timestamp echo reply: 1614528
    [SEQ/ACK analysis]
        [This is an ACK to the segment in frame: 13]
        [The RTT to ACK the segment was: 0.001641000 seconds]

Frame 15: 68 bytes on wire (544 bits), 68 bytes captured (544 bits) on interface 0
    Interface id: 0
    Encapsulation type: Linux cooked-mode capture (25)
    Arrival Time: Oct 17, 2014 21:01:50.553861000 JST
    [Time shift for this packet: 0.000000000 seconds]
    Epoch Time: 1413547310.553861000 seconds
    [Time delta from previous captured frame: 0.000025000 seconds]
    [Time delta from previous displayed frame: 0.000025000 seconds]
    [Time since reference or first frame: 1.234354000 seconds]
    Frame Number: 15
    Frame Length: 68 bytes (544 bits)
    Capture Length: 68 bytes (544 bits)
    [Frame is marked: False]
    [Frame is ignored: False]
    [Protocols in frame: sll:ip:tcp]
Linux cooked capture
    Packet type: Unicast to us (0)
    Link-layer address type: 772
    Link-layer address length: 6
    Source: 00:00:00_00:00:00 (00:00:00:00:00:00)
    Protocol: IP (0x0800)
Internet Protocol Version 4, Src: 127.0.0.1 (127.0.0.1), Dst: 127.0.0.1 (127.0.0.1)
    Version: 4
    Header length: 20 bytes
    Differentiated Services Field: 0x00 (DSCP 0x00: Default; ECN: 0x00: Not-ECT (Not ECN-Capable Transport))
        0000 00.. = Differentiated Services Codepoint: Default (0x00)
        .... ..00 = Explicit Congestion Notification: Not-ECT (Not ECN-Capable Transport) (0x00)
    Total Length: 52
    Identification: 0xbaba (47802)
    Flags: 0x02 (Don't Fragment)
        0... .... = Reserved bit: Not set
        .1.. .... = Don't fragment: Set
        ..0. .... = More fragments: Not set
    Fragment offset: 0
    Time to live: 64
    Protocol: TCP (6)
    Header checksum: 0x8207 [validation disabled]
        [Good: False]
        [Bad: False]
    Source: 127.0.0.1 (127.0.0.1)
    Destination: 127.0.0.1 (127.0.0.1)
    [Source GeoIP: Unknown]
    [Destination GeoIP: Unknown]
Transmission Control Protocol, Src Port: 35658 (35658), Dst Port: 5329 (5329), Seq: 7021, Ack: 1795, Len: 0
    Source port: 35658 (35658)
    Destination port: 5329 (5329)
    [Stream index: 0]
    Sequence number: 7021    (relative sequence number)
    Acknowledgment number: 1795    (relative ack number)
    Header length: 32 bytes
    Flags: 0x010 (ACK)
        000. .... .... = Reserved: Not set
        ...0 .... .... = Nonce: Not set
        .... 0... .... = Congestion Window Reduced (CWR): Not set
        .... .0.. .... = ECN-Echo: Not set
        .... ..0. .... = Urgent: Not set
        .... ...1 .... = Acknowledgment: Set
        .... .... 0... = Push: Not set
        .... .... .0.. = Reset: Not set
        .... .... ..0. = Syn: Not set
        .... .... ...0 = Fin: Not set
    Window size value: 387
    [Calculated window size: 49536]
    [Window size scaling factor: 128]
    Checksum: 0xfe28 [validation disabled]
        [Good Checksum: False]
        [Bad Checksum: False]
    Options: (12 bytes), No-Operation (NOP), No-Operation (NOP), Timestamps
        No-Operation (NOP)
            Type: 1
                0... .... = Copy on fragmentation: No
                .00. .... = Class: Control (0)
                ...0 0001 = Number: No-Operation (NOP) (1)
        No-Operation (NOP)
            Type: 1
                0... .... = Copy on fragmentation: No
                .00. .... = Class: Control (0)
                ...0 0001 = Number: No-Operation (NOP) (1)
        Timestamps: TSval 1614530, TSecr 1614529
            Kind: Timestamp (8)
            Length: 10
            Timestamp value: 1614530
            Timestamp echo reply: 1614529
    [SEQ/ACK analysis]
        [This is an ACK to the segment in frame: 14]
        [The RTT to ACK the segment was: 0.000025000 seconds]

